[
  {
    "id": 101,
    "title": "Camera singola · Via Caldirolo",
    "city": "Ferrara",
    "address": "Via Caldirolo",
    "lat": 44.830811,
    "lng": 11.6396,
    "price": 300,
    "expenses": null,
    "realMonthlyCost": 300,
    "realMonthlyCostStatus": "minimum_known",
    "availability": {"availableFrom": null,"availableLabel": "Agosto 2026","status": "unknown","confirmedAt": null,"nextCheckAt": null},
    "publication": {"authorized": false,"authorizationSource": null,"authorizedAt": null,"source": "annuncio reale raccolto","sourceUrl": null},
    "validation": {"contactProvided": false,"priceDeclared": true,"expensesDeclared": false,"contractDeclared": false,"depositDeclared": false,"utilitiesDeclared": false,"listingConfirmedAt": null},
    "campusReference": {"campusId": "mammut","campusName": "Mammut · Polo sanitario","distanceKm": 0.997,"distanceMethod": "great_circle","minutesWalk": null,"minutesBike": null,"minutesTransit": null},
    "contactWorkflow": null
  },
  {
    "id": 102,
    "title": "Camera · Via Adriano Aducco 10",
    "city": "Ferrara",
    "address": "Via Adriano Aducco 10",
    "lat": 44.8254999,
    "lng": 11.6349496,
    "price": 280,
    "expenses": null,
    "realMonthlyCost": 280,
    "realMonthlyCostStatus": "minimum_known",
    "availability": {"availableFrom": "2026-09-01","availableLabel": "1 settembre 2026","status": "unknown","confirmedAt": null,"nextCheckAt": null},
    "publication": {"authorized": false,"authorizationSource": null,"authorizedAt": null,"source": "annuncio reale raccolto","sourceUrl": null},
    "validation": {"contactProvided": false,"priceDeclared": true,"expensesDeclared": false,"contractDeclared": false,"depositDeclared": false,"utilitiesDeclared": false,"listingConfirmedAt": null},
    "campusReference": {"campusId": "mammut","campusName": "Mammut · Polo sanitario","distanceKm": 1.49,"distanceMethod": "great_circle","minutesWalk": null,"minutesBike": null,"minutesTransit": null},
    "contactWorkflow": null
  },
  {
    "id": 103,
    "title": "Camera singola · Via Mac Alister",
    "city": "Ferrara",
    "address": "Via Mac Alister",
    "lat": 44.8385325,
    "lng": 11.615143,
    "price": 380,
    "expenses": null,
    "realMonthlyCost": 380,
    "realMonthlyCostStatus": "minimum_known",
    "availability": {"availableFrom": "2026-09-01","availableLabel": "1 settembre 2026","status": "unknown","confirmedAt": null,"nextCheckAt": null},
    "publication": {"authorized": false,"authorizationSource": null,"authorizedAt": null,"source": "annuncio reale raccolto","sourceUrl": null},
    "validation": {"contactProvided": false,"priceDeclared": true,"expensesDeclared": false,"contractDeclared": false,"depositDeclared": false,"utilitiesDeclared": true,"listingConfirmedAt": null},
    "campusReference": {"campusId": "mammut","campusName": "Mammut · Polo sanitario","distanceKm": 1.496,"distanceMethod": "great_circle","minutesWalk": null,"minutesBike": null,"minutesTransit": null},
    "contactWorkflow": null
  },
  {
    "id": 104,
    "title": "Camera singola · Via Fossato di Mortara",
    "city": "Ferrara",
    "address": "Via Fossato di Mortara",
    "lat": 44.837238,
    "lng": 11.6295,
    "price": 440,
    "expenses": null,
    "realMonthlyCost": 440,
    "realMonthlyCostStatus": "minimum_known",
    "availability": {"availableFrom": "2026-09-01","availableLabel": "1 settembre 2026","status": "unknown","confirmedAt": null,"nextCheckAt": null},
    "publication": {"authorized": false,"authorizationSource": null,"authorizedAt": null,"source": "annuncio reale raccolto","sourceUrl": null},
    "validation": {"contactProvided": false,"priceDeclared": true,"expensesDeclared": false,"contractDeclared": false,"depositDeclared": false,"utilitiesDeclared": false,"listingConfirmedAt": null},
    "campusReference": {"campusId": "mammut","campusName": "Mammut · Polo sanitario","distanceKm": 0.407,"distanceMethod": "great_circle","minutesWalk": null,"minutesBike": null,"minutesTransit": null},
    "contactWorkflow": null
  },
  {
    "id": 105,
    "title": "Camera · Corso 1 Maggio",
    "city": "Ferrara",
    "address": "Corso 1 Maggio",
    "lat": 44.8449984,
    "lng": 11.6131294,
    "price": 450,
    "expenses": null,
    "realMonthlyCost": 450,
    "realMonthlyCostStatus": "minimum_known",
    "availability": {"availableFrom": null,"availableLabel": "Da verificare","status": "unknown","confirmedAt": null,"nextCheckAt": null},
    "publication": {"authorized": false,"authorizationSource": null,"authorizedAt": null,"source": "annuncio reale raccolto","sourceUrl": null},
    "validation": {"contactProvided": false,"priceDeclared": true,"expensesDeclared": false,"contractDeclared": false,"depositDeclared": false,"utilitiesDeclared": true,"listingConfirmedAt": null},
    "campusReference": {"campusId": "mammut","campusName": "Mammut · Polo sanitario","distanceKm": 1.789,"distanceMethod": "great_circle","minutesWalk": null,"minutesBike": null,"minutesTransit": null},
    "contactWorkflow": null
  }
]
